{
  "$schema": "https://json-schema.org/draft/2020-12/schema",
  "$id": "https://greedyq.dev/schemas/ai/study-state.schema.json",
  "title": "greedyQ Study State",
  "type": "object",
  "additionalProperties": false,
  "required": [
    "schema_version", "study_id", "study_version", "guide_version",
    "spec_version", "mode", "phase", "status", "checkpoint", "gates",
    "confirmed_decision_ids", "unresolved_decision_ids", "assumptions", "artifact_paths"
  ],
  "properties": {
    "schema_version": { "const": "0.2" },
    "study_id": { "type": "string", "pattern": "^[a-z][a-z0-9_]{1,63}$" },
    "study_version": { "type": "string", "minLength": 1 },
    "guide_version": { "type": "string", "minLength": 1 },
    "spec_version": { "type": "string", "minLength": 1 },
    "mode": { "enum": ["chat", "agent"] },
    "phase": {
      "enum": [
        "research_purpose", "hypotheses_estimands", "sampling_stopping",
        "design_randomization", "governance_consent_privacy", "questionnaire",
        "flow_outcomes", "analysis", "preregistration", "deployment",
        "fielding_ready"
      ]
    },
    "status": { "enum": ["in_progress", "blocked", "awaiting_approval", "complete"] },
    "checkpoint": {
      "enum": [
        "none", "design_confirmed", "instrument_confirmed", "governance_consent_confirmed", "interactive_preview_reviewed",
        "analysis_confirmed", "preregistration_draft", "validated",
        "deployment_candidate", "fielding_locked"
      ]
    },
    "updated_at": { "type": ["string", "null"], "format": "date-time" },
    "confirmed_decision_ids": {
      "type": "array",
      "uniqueItems": true,
      "items": { "type": "string", "pattern": "^dec_[a-z0-9_]+$" }
    },
    "unresolved_decision_ids": {
      "type": "array",
      "uniqueItems": true,
      "items": { "type": "string", "pattern": "^open_[a-z0-9_]+$" }
    },
    "assumptions": {
      "type": "array",
      "items": {
        "type": "object",
        "additionalProperties": false,
        "required": ["assumption_id", "statement", "material", "status"],
        "properties": {
          "assumption_id": { "type": "string", "pattern": "^asm_[a-z0-9_]+$" },
          "statement": { "type": "string", "minLength": 1 },
          "material": { "type": "boolean" },
          "status": { "enum": ["proposed", "confirmed", "rejected"] },
          "confirmation_decision_id": { "type": ["string", "null"] }
        }
      }
    },
    "artifact_paths": {
      "type": "array",
      "uniqueItems": true,
      "items": { "type": "string", "minLength": 1 }
    },
    "gates": {
      "type": "object",
      "additionalProperties": false,
      "required": ["design", "instrument", "analysis", "preregistration", "deployment", "fielding"],
      "properties": {
        "design": { "$ref": "#/$defs/gate" },
        "instrument": { "$ref": "#/$defs/gate" },
        "analysis": { "$ref": "#/$defs/gate" },
        "preregistration": { "$ref": "#/$defs/gate" },
        "deployment": { "$ref": "#/$defs/gate" },
        "fielding": { "$ref": "#/$defs/gate" }
      }
    },
    "next_question": { "type": ["string", "null"] },
    "notes": { "type": "array", "items": { "type": "string" } }
  },
  "$defs": {
    "gate": {
      "type": "object",
      "additionalProperties": false,
      "required": ["status"],
      "properties": {
        "status": { "enum": ["pending", "blocked", "approved", "verified", "not_applicable"] },
        "approval_decision_id": { "type": ["string", "null"] },
        "reason": { "type": ["string", "null"] }
      }
    }
  }
}
