{
  "schema_version": "0.2",
  "study_id": "greedyq_user_satisfaction_001",
  "study_version": "1.0.0-fixture",
  "guide_version": "0.2_2026-10-26_2b581a3",
  "spec_version": "0.2.0-draft.1",
  "mode": "agent",
  "phase": "deployment",
  "status": "awaiting_approval",
  "checkpoint": "validated",
  "updated_at": null,
  "confirmed_decision_ids": [
    "dec_purpose_population",
    "dec_instrument",
    "dec_consent_privacy",
    "dec_analysis",
    "dec_deployment_fixture"
  ],
  "unresolved_decision_ids": [
    "open_real_governance",
    "open_live_launch"
  ],
  "assumptions": [],
  "artifact_paths": [
    "greedyq.study.json",
    "survey.qmd",
    "greedyq.yml",
    "study-plan.md",
    "consent.md",
    "analysis/README.md",
    "analysis/data-dictionary.csv",
    "preview-model.json",
    "preview.html",
    "preview-test-report.md",
    ".greedyq/guide-lock.json",
    ".greedyq/validation-report.json",
    "supabase/migrations/001_initial.sql",
    "vercel.json",
    ".env.example",
    ".greedyq/normalized-survey.json",
    ".greedyq/validation-report.runtime.json",
    "index.html",
    "greedyq-core.js",
    "greedyq-runtime.css",
    "studio.html",
    "supabase/migrations/002_browser_rpc.sql",
    "results.html",
    "api/results.js",
    "supabase/migrations/003_results_dashboard.sql",
    "supabase/migrations/manifest.json",
    "greedyq-cbc.js"
  ],
  "gates": {
    "design": {
      "status": "approved",
      "approval_decision_id": "dec_purpose_population",
      "reason": "Approved as the greedyQSimple golden-reference purpose and population."
    },
    "instrument": {
      "status": "pending",
      "reason": "The source changed; review this version again."
    },
    "analysis": {
      "status": "approved",
      "approval_decision_id": "dec_analysis",
      "reason": "Approved as descriptive fixture intent."
    },
    "preregistration": {
      "status": "not_applicable",
      "approval_decision_id": null,
      "reason": "Preregistration is not enabled for this product-feedback fixture."
    },
    "deployment": {
      "status": "pending",
      "reason": "The source changed; review this version again."
    },
    "fielding": {
      "status": "pending",
      "reason": "The source changed; review this version again."
    }
  },
  "next_question": "Which real institution and researcher would be responsible for a live feedback survey?",
  "notes": [
    "This state describes a fictional golden-reference fixture.",
    "No production data collection or external operation has been performed."
  ]
}
