{
  "schema_version": "0.2",
  "study_id": "digital_service_info_001",
  "study_version": "1.0.0-fixture",
  "guide_version": "0.2_2026-10-26_e3958de",
  "spec_version": "0.2.0-draft.1",
  "mode": "agent",
  "phase": "preregistration",
  "status": "awaiting_approval",
  "checkpoint": "validated",
  "updated_at": null,
  "confirmed_decision_ids": [
    "dec_research_question",
    "dec_hypothesis",
    "dec_sampling_stopping",
    "dec_randomization",
    "dec_consent_privacy",
    "dec_instrument",
    "dec_analysis",
    "dec_preregistration_draft"
  ],
  "unresolved_decision_ids": [
    "open_real_contributors",
    "open_osf_submission"
  ],
  "assumptions": [],
  "artifact_paths": [
    "survey.qmd",
    "greedyq.yml",
    "consent.md",
    "analysis/README.md",
    "preregistration/osf-preregistration.md",
    "preregistration/artifact-manifest.json",
    "preview-model.json",
    "preview.html",
    "greedyq.study.json",
    "study-plan.md",
    ".greedyq/guide-lock.json",
    ".greedyq/validation-report.json",
    ".greedyq/normalized-survey.json",
    ".greedyq/validation-report.runtime.json",
    "index.html",
    "greedyq-core.js",
    "greedyq-runtime.css",
    "design/stimuli.csv",
    "analysis/data-dictionary.csv",
    "preregistration/preregistration.json",
    "studio.html",
    "supabase/migrations/002_browser_rpc.sql",
    "results.html",
    "api/results.js",
    "supabase/migrations/003_results_dashboard.sql",
    "supabase/migrations/001_initial.sql",
    "supabase/migrations/manifest.json",
    "greedyq-cbc.js"
  ],
  "gates": {
    "design": {
      "status": "approved",
      "approval_decision_id": "dec_randomization",
      "reason": "Approved as a fictional golden-reference design."
    },
    "instrument": {
      "status": "pending",
      "reason": "The source changed; review this version again."
    },
    "analysis": {
      "status": "approved",
      "approval_decision_id": "dec_analysis",
      "reason": "Confirmed as fixture analysis intent, not a real-study preregistration."
    },
    "preregistration": {
      "status": "blocked",
      "approval_decision_id": null,
      "reason": "Real contributors and an explicit OSF submission approval are absent."
    },
    "deployment": {
      "status": "pending",
      "reason": "The source changed; review this version again."
    },
    "fielding": {
      "status": "pending",
      "reason": "The source changed; review this version again."
    }
  },
  "next_question": "Who are the real contributors and institutional affiliations for a future OSF registration?",
  "notes": [
    "This state describes a fictional pre-implementation fixture.",
    "No OSF, Vercel, Supabase, or Prolific production operation has been performed."
  ]
}
